{
  "artifact_id": "V.FULL_DEMO",
  "run_id": "full_demo",
  "target_artifact": "roman_to_int.py",
  "kind": "command_test",
  "source": "independent_verifier_agent",
  "provenance_level": "P2",
  "depends_on_solution": false,
  "same_worker_as_solution": false,
  "executes_code": true,
  "assertion_count": 35,
  "mock_ratio_percent": 0,
  "smell_flags": [],
  "authority": "certifying",
  "solution_exists_at_creation": false,
  "created_at": "2026-05-10T00:00:00Z",
  "created_at_phase": "pre_solution",
  "author_agent": "verifier-generator",
  "author_model": "deepseek-v4-flash"
}
